name,gender,source_name,source_url,source_title,source_extract
Blake,boy,Wikipedia - Blake (given name),https://en.wikipedia.org/wiki/Blake_%28given_name%29,Blake (given name),"Blake is a unisex given name, which originated from Old English. Its derivation is uncertain; it could come from ""blac"", a nickname for someone who had dark hair or skin, or from ""blaac"", a nickname for someone with pale hair or skin."
Bodhi,boy,,,,
Braxton,boy,Wikipedia - Braxton (given name),https://en.wikipedia.org/wiki/Braxton_%28given_name%29,Braxton (given name),"Braxton is a given name of English origin meaning ""badger"", as well as ""Brock's town"".
People with the given name include:

Braxton Ashcraft (born 1999), American baseball player
Braxton Beacham (1864–1924), American politician
Braxton Berrios (born 1995), American football player
Braxton Bragg (1817–1876), American officer and Civil War Confederate general
Braxton Bragg (baseball) (born 2000), American baseball player
Braxton Burmeister (born 1998), American football player
Braxton Cook (born 1991), American musician
Braxton Craven (1822–1882), American educator
Braxton Davidson (born 1996), American baseball player
Braxton Garrett (born 1997), American baseball player
Braxton Harris (born 1983/1984), American football coach
Braxton Hoyett (born 1996), American football player
Braxton Jones (born 1999), American football player
Braxton Kelley (born 1986), American football player
Braxton Key (born 1997), American basketball player
Braxton Lee (born 1993), American baseball player
Braxton Miller (born 1992), American football player
Braxton Mitchell (born 2000), American politician
Braxton Pope, American filmmaker
Braxton Powell (1944–2010), American politician
Braxton Sorensen-McGee (born 2006), New Zealand rugby union player
Braxton Stone-Papadopoulos (born 1995), Canadian wrestler
Braxton Taghvai-Najib (born 2002), American soccer player"
Brodie,boy,Wikipedia - Brodie,https://en.wikipedia.org/wiki/Brodie,Brodie,"Brodie  can be a given name or a surname of Scottish origin, and a location in Moray, Scotland, its meaning is uncertain; it is not clear if Brodie, as a word, has its origins in the Gaelic or Pictish languages. In 2012 this name became the 53rd most popular boys' name in Scotland. The given name originates from the surname."
Bubba,boy,,,,
Caleb,boy,Wikipedia - Caleb (given name),https://en.wikipedia.org/wiki/Caleb_%28given_name%29,Caleb (given name),"Caleb is a masculine given name derived from Hebrew, meaning ""faithful"" or ""whole-hearted""."
Callum,boy,Wikipedia - Callan,https://en.wikipedia.org/wiki/Callan,Callan,"Callan is a masculine given name and surname of Irish and Scottish origin. It can derive from Ó Cathaláin (""descendant of Cathalán"") or be an Anglicized form of the Gaelic Mac Allin or Mac Callin.
Notable people with the name include:"
Cameron,boy,Wikipedia - Cameron (given name),https://en.wikipedia.org/wiki/Cameron_%28given_name%29,Cameron (given name),"Cameron is a given name in the English language.
The name originates from the Scottish surname Cameron.
A variant spelling of the given name is Camron. Modern variants of the name are Kameron, Kamron and Camryn. A shortened form of the given name Cameron is Cam."
Carter,boy,Wikipedia - Carter (name),https://en.wikipedia.org/wiki/Carter_%28name%29,Carter (name),"Carter is an English surname and given name that means ""one who uses a cart"". It is derived from Anglo-Norman careter or caretier.
In England, the earliest recorded use of the surname Carter dates back to 1192–1193, as evidenced by the entry of Norman knight Rannulf le Caretier in the Pipe Rolls of Huntingdonshire. This record appears during the reign of King Richard I, also known as Richard the Lionheart who ruled from 1189 to 1199. Close to a century later, on the Hundred Rolls of 1273, a census of Wales and England, includes six early bearers of the surname: Jocius Catetarius in Oxfordshire, Juliana le Cartere in Cambridgeshire, Nicholas le Carter in Oxfordshire, John le Cartere in Norfolk, Robert le Caretter in Huntingdonshire, and Margaret le Careter in Huntingdonshire. The Poll Tax of Yorkshire from 1379 lists Richardus Carter as another bearer of the surname in an Anglicized form.
Following the Norman invasion of Ireland in the 1100s, Roman Catholic English-derived Carters also arrived in Ireland and settled into walled towns established by the Normans. These Anglo-Normans assimilated into Irish culture, adopting Irish Gaelic customs, language, and religion, becoming what is referred to in Irish historiography as ""more Irish than the Irish themselves."" The later English and Scottish Protestant planter settlers in Ireland who arrived between the 1550s and 1700 and mainly settled in Ulster during the plantation of Ulster, established the Ulster Protestant community and remained a distinct class and group.
The Statutes of Kilkenny in 1366, which aimed to curb the decline of the Hiberno-Norman Lordship of Ireland, established that every Englishman or Irish living amongst the English use the English language and adopt English naming and customs or be thrown in jail and lose property. It was declared for those Irish living in The Pale, to take an English surname either after a town, colour, trade, or office, which also contributed to the proliferation of Anglo and Anglicized surnames.
Today, Carter is the 44th most common surname in the United States and 56th most common in England. In Ireland it is ranked between McGarry and Cannon where it is found with greatest frequency in County Laois as the 70th most common surname and also has significant presence in Dublin, Cork, and Limerick. In Scotland it is found with greatest frequency in the Outer Hebrides.
The Carter surname was forced upon African Americans as formerly enslaved people lost their family names long before the Emancipation and 13th Amendment to their masters (who were typically of English or Scottish descent), or through the common mixing found between Irish immigrants and free African Americans in Northern cities and communities such as Five Points and Seneca Village in New York City and elsewhere in the United States. This name is common among African Americans capable of tracing their roots back to the southern United States or Caribbean from the early 20th century and prior, with some 35% of name holders of Carter in the United States being of African American descent and it being the 22nd most common surname for Black Americans."
Charlie,boy,Wikipedia - Charlie (given name),https://en.wikipedia.org/wiki/Charlie_%28given_name%29,Charlie (given name),"Charlie is a traditionally masculine given name in English-speaking countries, often a nickname for Charles, but is now used as a unisex name.  It is also used as a surname.
For girls, Charlie acts either as a nickname for Charlotta, Charlotte, Charlize, or Charlene, or sometimes on its own. The different forms of spelling are most commonly used for the feminine forms. These spelling variants include Charlee, Charli, Charly, and Charleigh. Charley is another spelling variant for any gender."
Chase,boy,Wikipedia - Chase (given name),https://en.wikipedia.org/wiki/Chase_%28given_name%29,Chase (given name),"Chase is a given name in the English speaking world, especially popular in the United States. The given name is a transferred use of the surname."
Christian,boy,Wikipedia - Christian (given name),https://en.wikipedia.org/wiki/Christian_%28given_name%29,Christian (given name),"Christian is a unisex given name, which originated as a baptismal name used by persons of the Christian religion. It has been used as a given name since the Middle Ages.
A historically commonly used abbreviation (used for example on English 17th-century church monuments and pedigrees) is Xpian, using the Greek Chi Rho Christogram Χρ, short for Χριστός, Christ. An example is Xpian Rolle, a daughter of George Rolle (d.1552). The Greek form of the baptismal name is Χριστιανός, a Christian. The name denotes a follower of Jesus Christ, thus a Christian. The common noun and adjective christian are only found in English from the 16th century but the name Christian is found from the 12th century. The Old English form of the noun was christen.
In Europe it was almost exclusively used as a male name but in Britain it was more common for females and used interchangeably with the French Christine. It was common for women in Britain from the middle ages up until the 17th century.   Female variants of the name include Christine, Christina, Christiane, Cristiane, Kristen, Cristina, Kristin, and Kirsten."
Christopher,boy,Wikipedia - Christopher,https://en.wikipedia.org/wiki/Christopher,Christopher,"Christopher is the English version of a Europe-wide name derived from the Greek name Χριστόφορος (Christophoros or Christoforos). The constituent parts are Χριστός (Christós), ""Christ"" or ""Anointed"", and φέρειν (phérein), ""to bear""; hence the ""Christ-bearer"".
As a given name, 'Christopher' has been in use since the 10th century.
In English, Christopher may be abbreviated as ""Chris"", ""Topher"", and sometimes ""Kit"".
It was frequently the most popular male first name in the United Kingdom, having been in the top twenty in England and Wales from the 1940s until 1995, although it has since dropped out of the top 100. Within the United Kingdom, the name is most common in England and not so common in Wales, Scotland, or Northern Ireland."
Cody,boy,Wikipedia - Cody (given name),https://en.wikipedia.org/wiki/Cody_%28given_name%29,Cody (given name),"Cody is a name in the English language, ultimately of Irish origin. Spellings include Codi, Codie, Coedee, Kodi, Kodie, and Kody. Other variants are Coady and Codey.
According to A Dictionary of First Names, Cody is ""a transferred use of the Irish surname, an Anglicized form of Gaelic O'Cuidighthigh meaning 'descendant of Cuidightheach' (originally a byname for a helpful person), or of Mac Óda 'son of Óda' (a personal name of uncertain origin)"".
In the United States, the name Cody is often associated with the west, specifically California. 
Notable people and characters with these names include:"
Cohen,boy,Wikipedia - Cohen (given name),https://en.wikipedia.org/wiki/Cohen_%28given_name%29,Cohen (given name),"Cohen is a masculine given name of Hebrew origin. It derives from the surname of the same spelling, meaning ""priest."" Cohen is a title associated with hereditary priests, most of whom descended from Aaron, the brother of Moses."
